{
  "$id": "scenarios/missed_deadline.v2.schema.json",
  "$schema": "https://json-schema.org/draft/2020-12/schema",
  "additionalProperties": false,
  "description": "Closed onboarding handover schema v2.",
  "properties": {
    "beats": {
      "items": {
        "additionalProperties": false,
        "properties": {
          "act": {
            "type": "string"
          },
          "id": {
            "type": "string"
          },
          "npc": {
            "type": "string"
          },
          "when": {
            "type": "string"
          }
        },
        "required": [
          "id",
          "npc",
          "when",
          "act"
        ],
        "type": "object"
      },
      "minItems": 1,
      "type": "array"
    },
    "briefing": {
      "properties": {
        "en": {
          "minLength": 1,
          "type": "string"
        }
      },
      "required": [
        "en"
      ],
      "type": "object"
    },
    "canon": {
      "additionalProperties": false,
      "properties": {
        "private": {
          "type": "object"
        },
        "public": {
          "type": "object"
        }
      },
      "required": [
        "public",
        "private"
      ],
      "type": "object"
    },
    "clock": {
      "additionalProperties": false,
      "properties": {
        "advance_on_turn": {
          "const": false
        },
        "day": {
          "const": 0
        }
      },
      "required": [
        "day",
        "advance_on_turn"
      ],
      "type": "object"
    },
    "commitment_model": {
      "additionalProperties": false,
      "properties": {
        "agreement_npc": {
          "type": "string"
        },
        "assistance_requires": {
          "items": {
            "type": "string"
          },
          "type": "array"
        },
        "assisted_min_day": {
          "type": "integer",
          "minimum": 0
        },
        "latest_day_from": {
          "type": "string"
        },
        "unassisted_min_day": {
          "type": "integer",
          "minimum": 0
        }
      },
      "required": [
        "unassisted_min_day",
        "assisted_min_day",
        "assistance_requires",
        "latest_day_from",
        "agreement_npc"
      ],
      "type": "object"
    },
    "end": {
      "additionalProperties": false,
      "properties": {
        "max_turns": {
          "minimum": 1,
          "type": "integer"
        }
      },
      "required": [
        "max_turns"
      ],
      "type": "object"
    },
    "facts": {
      "items": {
        "additionalProperties": false,
        "properties": {
          "content": {
            "properties": {
              "en": {
                "minLength": 1,
                "type": "string"
              }
            },
            "required": [
              "en"
            ],
            "type": "object"
          },
          "id": {
            "type": "string"
          },
          "leak_keywords": {
            "properties": {
              "en": {
                "items": {
                  "type": "string"
                },
                "minItems": 1,
                "type": "array"
              }
            },
            "required": [
              "en"
            ],
            "type": "object"
          },
          "owner": {
            "type": "string"
          },
          "triggers": {
            "items": {
              "type": "string"
            },
            "minItems": 1,
            "type": "array"
          },
          "unlock_question": {
            "properties": {
              "en": {
                "minLength": 1,
                "type": "string"
              }
            },
            "required": [
              "en"
            ],
            "type": "object"
          },
          "weight": {
            "exclusiveMinimum": 0,
            "type": "number"
          },
          "paraphrase_questions": {
            "type": "object",
            "required": [
              "en"
            ],
            "additionalProperties": false,
            "properties": {
              "en": {
                "type": "array",
                "minItems": 2,
                "items": {
                  "type": "string",
                  "minLength": 1
                }
              }
            }
          }
        },
        "required": [
          "id",
          "owner",
          "weight",
          "content",
          "triggers",
          "leak_keywords",
          "unlock_question",
          "paraphrase_questions"
        ],
        "type": "object"
      },
      "minItems": 2,
      "type": "array"
    },
    "goals": {
      "items": {
        "additionalProperties": false,
        "properties": {
          "done_when": {
            "items": {
              "type": "string"
            },
            "minItems": 1,
            "type": "array"
          },
          "id": {
            "type": "string"
          },
          "label": {
            "minLength": 1,
            "type": "string"
          },
          "required": {
            "type": "boolean"
          },
          "requires": {
            "items": {
              "type": "string"
            },
            "type": "array"
          },
          "visible": {
            "type": "boolean"
          },
          "weight": {
            "exclusiveMinimum": 0,
            "type": "number"
          }
        },
        "required": [
          "id",
          "visible",
          "required",
          "weight",
          "label",
          "done_when",
          "requires"
        ],
        "type": "object"
      },
      "type": "array"
    },
    "id": {
      "const": "missed_deadline",
      "type": "string"
    },
    "locales": {
      "items": {
        "type": "string"
      },
      "minItems": 1,
      "type": "array"
    },
    "npcs": {
      "items": {
        "additionalProperties": false,
        "properties": {
          "default_sliders": {
            "additionalProperties": false,
            "properties": {
              "assertiveness": {
                "type": "number",
                "minimum": 0,
                "maximum": 100
              },
              "forthcomingness": {
                "type": "number",
                "minimum": 0,
                "maximum": 100
              },
              "patience": {
                "type": "number",
                "minimum": 0,
                "maximum": 100
              },
              "warmth": {
                "type": "number",
                "minimum": 0,
                "maximum": 100
              }
            },
            "required": [
              "assertiveness",
              "patience",
              "warmth",
              "forthcomingness"
            ],
            "type": "object"
          },
          "id": {
            "type": "string"
          },
          "name": {
            "type": "string"
          },
          "persona": {
            "minLength": 1,
            "type": "string"
          },
          "public_context": {
            "minLength": 1,
            "type": "string"
          },
          "role": {
            "type": "string"
          },
          "topics": {
            "items": {
              "type": "string"
            },
            "type": "array"
          }
        },
        "required": [
          "id",
          "name",
          "role",
          "persona",
          "public_context",
          "default_sliders",
          "topics"
        ],
        "type": "object"
      },
      "minItems": 1,
      "type": "array"
    },
    "player": {
      "additionalProperties": false,
      "properties": {
        "id": {
          "type": "string"
        },
        "name": {
          "type": "string"
        },
        "role": {
          "type": "string"
        }
      },
      "required": [
        "id",
        "name",
        "role"
      ],
      "type": "object"
    },
    "scoring": {
      "additionalProperties": false,
      "properties": {
        "version": {
          "const": 3
        },
        "weights": {
          "additionalProperties": false,
          "properties": {
            "goals": {
              "type": "number"
            },
            "hidden_facts": {
              "type": "number"
            },
            "integrity": {
              "type": "number"
            },
            "relationship": {
              "type": "number"
            },
            "rubric": {
              "type": "number"
            }
          },
          "required": [
            "goals",
            "hidden_facts",
            "integrity",
            "relationship",
            "rubric"
          ],
          "type": "object"
        },
        "penalties": {
          "type": "object",
          "additionalProperties": false,
          "properties": {
            "unrealistic_commitment": {
              "type": "number",
              "minimum": 0
            },
            "contradicted_commitment": {
              "type": "number",
              "minimum": 0
            },
            "inaccurate_relay": {
              "type": "number",
              "minimum": 0
            }
          },
          "required": [
            "unrealistic_commitment",
            "contradicted_commitment",
            "inaccurate_relay"
          ]
        },
        "bands": {
          "type": "array",
          "items": {
            "type": "object",
            "additionalProperties": false,
            "properties": {
              "minimum": {
                "type": "number"
              },
              "label": {
                "type": "string"
              }
            },
            "required": [
              "minimum",
              "label"
            ]
          }
        },
        "relationship_population": {
          "const": "all_scenario_npcs"
        }
      },
      "required": [
        "version",
        "weights"
      ],
      "type": "object"
    },
    "title": {
      "minLength": 1,
      "type": "string"
    },
    "version": {
      "const": 2
    },
    "plan_model": {
      "type": "object",
      "additionalProperties": false,
      "required": [
        "version",
        "primaryDay",
        "followUpDay",
        "actors"
      ],
      "properties": {
        "version": {
          "const": 1
        },
        "primaryDay": {
          "const": 3
        },
        "followUpDay": {
          "const": 6
        },
        "actors": {
          "type": "object",
          "additionalProperties": false,
          "required": [
            "engineering",
            "qa",
            "external",
            "manager",
            "instructions",
            "manual"
          ],
          "properties": {
            "engineering": {
              "const": "jordan"
            },
            "qa": {
              "const": "sam"
            },
            "external": {
              "const": "client"
            },
            "manager": {
              "const": "maya"
            },
            "instructions": {
              "const": "alex"
            },
            "manual": {
              "const": "client_operations"
            }
          }
        }
      }
    }
  },
  "required": [
    "id",
    "version",
    "locales",
    "title",
    "briefing",
    "player",
    "clock",
    "canon",
    "commitment_model",
    "npcs",
    "goals",
    "facts",
    "beats",
    "end",
    "scoring",
    "plan_model"
  ],
  "title": "MissedDeadlineV2Scenario",
  "type": "object"
}
